{
  "schemaVersion": 1,
  "id": "wireless",
  "extends": [
    "recommended"
  ],
  "targets": [
    "*"
  ],
  "requiredPackages": [],
  "recommendedPackages": [
    "iw-full",
    "rpcd-mod-iwinfo"
  ],
  "conditionalPackages": [],
  "expectedCommands": [
    "iw"
  ],
  "expectedCapabilities": []
}
